{
  "run_version": 0,
  "run_id": "run_550e8400-e29b-41d4-a716-446655440000",

  "exec": {
    "argv": ["uv", "run", "python", "-m", "plc.runner", "--i", "7"],
    "cwd": ".",
    "env": {
      "WANDB_DIR": "./outputs",
      "CUDA_VISIBLE_DEVICES": "0"
    },
    "timeout_sec": 3600
  },

  "code_state": {
    "repo_url": "git@github.com:org/repo.git",
    "base_commit": "a1b2c3d4e5f6789012345678901234567890abcd",
    "patch": {
      "ref": "refs/patches/run_550e8400-e29b-41d4-a716-446655440000",
      "sha256": "e3b0c44298fc1c149afbf4c8996fb92427ae41e4649b934ca495991b7852b855"
    }
  }
}
