{
    "run_version": 0,
    "run_id": "run_550e8400-e29b-41d4-a716-446655440000",
    "exec": {
        "argv": ["echo", "test"],
        "cwd": "."
    },
    "code_state": {
        "repo_url": "git@github.com:org/repo.git",
        "base_commit": "a1b2c3d4e5f6789012345678901234567890abcd"
    }
}
